{
  "schema": "ev4-action-batch@1.0.0",
  "selected_candidate_id": "cand-a",
  "approved_class_map": ["ev4-card"],
  "max_normal_actions": 5,
  "checkpointed": true,
  "evidence": { "desktop": true },
  "actions": [
    {
      "action_id": "BATCH-001-A01",
      "target_node": "node-card",
      "element_type": "container",
      "class_name": "ev4-card",
      "class_scope": "Local Classes",
      "class_operation": "preserve",
      "control_family": "structure",
      "control_name": "create_element",
      "responsive_scope": "desktop",
      "risk_level": "low",
      "evidence_required": ["structure_panel"],
      "confirmation_scope": "BATCH-001-A01 structure",
      "allowed_class_source": "approved_class_map",
      "forbidden_changes": ["selected_candidate_id_change"],
      "expected_result": "Card container exists.",
      "decision_lineage_ref": {
        "decision_family": "widget_mapping",
        "decision_card_ref": "KERNEL-CARD-WIDGET-MAPPING-001",
        "selected_option": "container",
        "rejected_options": ["section", "custom_html"],
        "evidence_refs": ["ce-builder-package:widget_mapping_table[0]", "architect-export:approved_structure_tree[0]"],
        "evidence_state": "validated",
        "consumer_stage": "builder"
      }
    },
    {
      "action_id": "BATCH-001-A02",
      "target_node": "node-card",
      "element_type": "container",
      "control_family": "layout",
      "control_name": "display",
      "value": "flex",
      "responsive_scope": "desktop",
      "risk_level": "low",
      "evidence_required": ["structure_panel"],
      "confirmation_scope": "BATCH-001-A02 mechanical layout",
      "allowed_class_source": "none",
      "forbidden_changes": ["selected_candidate_id_change"],
      "expected_result": "Existing card uses flex layout."
    }
  ]
}
