{"schema":"ev4-action-batch@1.0.0","selected_candidate_id":"cand-a","approved_class_map":["ev4-card"],"max_normal_actions":5,"checkpointed":true,"evidence":{"desktop":true},"actions":[{"action_id":"A1","target_node":"node-card","element_type":"container","class_name":"ev4-card","class_operation":"preserve","control_family":"layout","control_name":"display","value":"flex","responsive_scope":"desktop","risk_level":"low","evidence_required":["structure_panel"],"confirmation_scope":"A1 structure","allowed_class_source":"approved_class_map","forbidden_changes":["selected_candidate_id_change"],"expected_result":"Card container exists."}]}
